{
  "reversalId": "50000000-0000-4000-8000-000000000001",
  "tenantId": "50000000-0000-4000-8000-000000000002",
  "paymentId": "50000000-0000-4000-8000-000000000003",
  "merchantId": "50000000-0000-4000-8000-000000000004",
  "status": "COMPLETED",
  "amount": "25.00",
  "currency": "SAR",
  "aggregateVersion": 3,
  "completedAt": "2026-08-10T10:03:00Z",
  "attemptId": "50000000-0000-4000-8000-000000000005",
  "providerEvidenceId": "50000000-0000-4000-8000-000000000006",
  "ledgerTransactionId": "50000000-0000-4000-8000-000000000007"
}
